{
  "version": "1.0",
  "verification": "compiled-and-regression-backed",
  "id": "confidence-band",
  "family": "plot",
  "title": "Confidence band with mean curve",
  "description": "Publication plot with upper/lower bounds, filled uncertainty band, and a central mean series.",
  "recipe_hint": "confidence-band",
  "source_golden": "examples/golden/confidence-band",
  "tags": [
    "uncertainty",
    "confidence band",
    "mean curve",
    "publication plot"
  ],
  "supported_profiles": [
    "journal-single-column",
    "journal-double-column"
  ],
  "supported_themes": [
    "journal-monochrome",
    "journal-muted",
    "journal-accessible"
  ],
  "requires": {
    "packages": [
      "tikz",
      "pgfplots"
    ],
    "libraries": [
      "fillbetween"
    ]
  },
  "edit_contract": {
    "editable": [
      "axis labels",
      "axis ranges",
      "series expressions/data",
      "legend",
      "band opacity",
      "theme/profile"
    ],
    "structural_limits": {
      "series": [
        3,
        6
      ],
      "bands": [
        1,
        2
      ]
    },
    "locked": [
      "uncertainty bounds must be supplied by the user/data",
      "do not invent statistical confidence levels"
    ]
  }
}
