{
  "version": "1.0",
  "verification": "compiled-and-regression-backed",
  "id": "scatter-meta",
  "family": "plot",
  "title": "Metadata-driven scatter plot",
  "description": "Publication scatter plot where explicit point metadata drives marker color and a quantitative colorbar.",
  "recipe_hint": "scatter-plot",
  "source_golden": "examples/golden/scatter-plot",
  "tags": ["scatter", "point meta", "colorbar", "publication plot"],
  "supported_profiles": ["journal-single-column", "journal-double-column"],
  "supported_themes": ["journal-monochrome", "journal-muted", "journal-accessible"],
  "requires": {"packages": ["tikz", "pgfplots"], "libraries": []},
  "edit_contract": {
    "editable": ["axis labels", "data file", "metadata column", "colorbar label", "marker size", "theme/profile"],
    "structural_limits": {"series": [1, 8], "metadata_dimensions": [0, 1]},
    "locked": [
      "point metadata must come from supplied data",
      "encoded color must remain decodable by a legend or colorbar"
    ]
  }
}
